{
  "schema": "transfer-qualification-lock/1",
  "version": "TRANSFER-01B/1",
  "live_authorized": false,
  "corpus_status": "PROPOSED_UNADJUDICATED",
  "policy": {
    "maxCalls": 48,
    "maxInputUnits": 12000,
    "maxOutputTokens": 2048,
    "maxOutputBytes": 8192,
    "maxWireBytes": 3000,
    "maxTotalInputUnits": 576000,
    "maxTotalOutputTokens": 98304,
    "timeoutMs": 1000,
    "retries": 0,
    "fallback": false,
    "proposedUsd": 1,
    "liveAuthorized": false
  },
  "models": {
    "A": {
      "id": "deepseek-v4.1-flash",
      "api": "openai-completions",
      "base_url": "https://opencode.ai/zen/go/v1"
    },
    "B": {
      "id": "qwen3.8-flash",
      "api": "anthropic-messages",
      "base_url": "https://opencode.ai/zen/go"
    },
    "C": {
      "id": "glm-5.3",
      "api": "openai-completions",
      "base_url": "https://opencode.ai/zen/go/v1"
    }
  },
  "prompt_hashes": {
    "A": "924b114b9a712724fbc7d3d3aa51d75c9a25cb4351e15b93d36fa6bd52ceb481",
    "B": "dc69b4dc26f8ef65f4fa28906888c89200a814b9b4ea06ec67a5199b799cb124",
    "C": "10dbeb4ac145fa78cdd29b1a5d98415a4e1e6b11c4856c4dc8655748f8a17c3e"
  },
  "settings": {
    "maxTokens": 2048,
    "maxRetries": 0,
    "cacheRetention": "none"
  },
  "files": {
    "experiments/communication-transfer-v1/src/qualification/browser.mjs": "9aa09b39c30171e2f3b86bdd555bfe988eeffd0a96600e0e785c70ab177de87e",
    "experiments/communication-transfer-v1/src/qualification/contracts.mjs": "6f0300e774ad0bbada9d908e76c5fc1f85ffe045bae917d14d6b5553a93a3dbc",
    "experiments/communication-transfer-v1/src/qualification/corpus.mjs": "932485204af47d34d50a8f61956737e212e10f76faff28515630f7652422ca93",
    "experiments/communication-transfer-v1/src/qualification/lock.mjs": "6b6d6fb8412a2b2d93f423e61436bf876b9ab3d7c4e9662edbd3cacc32857a76",
    "experiments/communication-transfer-v1/src/qualification/run.mjs": "f6f749a8513370dd8028bc1442a4029a4d84eeb6dfe52d5be8f7d5c5aa537d5b",
    "experiments/communication-transfer-v1/src/qualification/transport.mjs": "00a4e7cc815f437c07025b464eb0c3fc5fe76659c3f9fb1b18b1a68873203f56",
    "experiments/communication-transfer-v1/src/qualification/viewer.mjs": "3d848e8b57910e747d7c908fd97e0c8ecf61febdf1534e5e75dce078b2aad898",
    "experiments/communication-transfer-v1/fixtures/pilot-v1/deployment-policy-v1.json": "1850d2d43196d38e42c37302969e3095ef315ff69e1e14632b9a6b35022992b0",
    "experiments/communication-transfer-v1/fixtures/pilot-v1/schemas/advisory-v1.schema.json": "c39de8bdfcc7b1e8681b6ba7c10d0e77b15f6ce816fe42da15ffde7e4e7477f8",
    "experiments/communication-transfer-v1/fixtures/pilot-v1/schemas/context-v1.schema.json": "dfcf8b425e6a4c08f292e0eb34a72031442dc95ecb995ff9386232895e697996",
    "experiments/communication-transfer-v1/fixtures/pilot-v1/schemas/qualification_lock-v1.schema.json": "c9a0796a25fe453fadd1476e6ebafd3de2ba2a9374d571181122c4ac4ca1f6f2",
    "experiments/communication-transfer-v1/fixtures/pilot-v1/schemas/recipient-v1.schema.json": "d69b14230a08a5796866750cbcba0a1f57bf5d82b50eb04350caf99903013f7f",
    "experiments/communication-transfer-v1/fixtures/pilot-v1/schemas/sender-v1.schema.json": "ba4ec5ccaa929abed305efad09cdbb633dbfaffc64e5525a43ea29833f9adcad",
    "experiments/communication-transfer-v1/fixtures/pilot-v1/schemas/task-v1.schema.json": "47aecec1a7b4fb0df479b084a7f778200f23b58b2964e2fb773324348de9a491",
    "experiments/communication-transfer-v1/fixtures/pilot-v1/study-interpretation-v1.json": "38733af1fbb94664f49970c90b5a0821b6d84f1fe68564fd9ce0e6c609b69e37",
    "core/admission/fixtures/retry-context.ts": "10d72a6deb10cf1e2e1900fbd6cf67b54506ca7330f5cd70438d9913998b2293",
    "core/admission/src/index.ts": "64d71a18280170957d3bec2c905dbfdf707551860343b8f458dd21f79325fd5a",
    "core/admission/tests/admission.test.ts": "c39faf3747c46fbee3add89eef9e51bfb32cf058c35d52a7adf84d91f9fbef2c",
    "core/authority/policy.example.json": "51e2e91505a7a3e4f92e5a7c555e04a20c824d6f86dc73672c7c6bfb787db8e1",
    "core/authority/src/boundary.ts": "c85bf152c0ef60b8c8c2f8491c751bbe8399fc91485f5c4085c87dfa63b05af0",
    "core/authority/src/engine/evaluate.ts": "901062acb27ca951537275bd3fbd83dc9ef1286f88d6839cf4e876e8c71d1a3a",
    "core/authority/src/engine/index.ts": "3b5f50638fcee4385f64ae2ebd77f7e760c6b71633c1c33c0993ce78a7dba4d7",
    "core/authority/src/engine/types.ts": "8674b11414b9ffb0f57d48725f66bd90ca8fe73731cdd3a4c92034af93cc0b90",
    "core/authority/src/gate.ts": "19cfbd1fa898f4f5e70bf8a2f65084470b84bd12c6cd6fce42ad1ec791e335ce",
    "core/authority/src/validation.ts": "f1e2f6d658d927f5295b9ba0c35df8673234ab72c7d69c256b02228999cb4c62",
    "core/authority/tests/evaluate.test.ts": "5172b91fe108d174416a76a1dbdb771dba6e327da39feb59f3a49308ffd0c787",
    "core/browser/fixtures/incident.ts": "93a2e75e2d326f65e606b0b6546c5cbb8d99e7003c2c2bae597345bf3170ecc6",
    "core/browser/src/index.ts": "953f988a5b6e3e7da005f360c8d67e6b9d5f554a779146849cda36e9c6779188",
    "core/browser/tests/browser.test.ts": "73765044b91c921c62a14dcd35bfd6c533dcedfa974c5b5996d037bc3fe624d6",
    "core/compiler/README.upstream.md": "cfe7805f34a5997be0ca722bbf381f34a6b46a11f7f342c8c54d6f985032fe61",
    "core/compiler/conformance/compiler-v1/budget-slack.candidates.json": "8c1af4b68aec611e0d583e27dcd920b5d9c1caf32cb9a2a9306d63a456b32251",
    "core/compiler/conformance/compiler-v1/budget-slack.request.json": "e4cac7156b3a25188b005e075fb045db8968a218070a5569c445c9359e85af4e",
    "core/compiler/conformance/compiler-v1/compiler-policy-v1.json": "de53eacc8fefe5b40035b05973c65e1593336e212a3eb830714b862d658474ca",
    "core/compiler/conformance/compiler-v1/conflict-trap.candidates.json": "93211bab540eb90f2177b23a4b98965b0b5824aca2aa9f979b53602f9314bce9",
    "core/compiler/conformance/compiler-v1/conflict-trap.request.json": "2775b10d90a8230f012f641e0e68c5e75e48b4b0960f57b4dfb4c3d1f644ac55",
    "core/compiler/conformance/compiler-v1/dependency-cycle.candidates.json": "bc9545463ec752049efa584365b8bf4aedfa7d2865c9d867e5c49a59017f9165",
    "core/compiler/conformance/compiler-v1/dependency-cycle.request.json": "a9a501a4134d0131461c95cf0a12105df4acac415dd9258c24a753a129042d0a",
    "core/compiler/conformance/compiler-v1/dependency-trap.candidates.json": "663681453054db5baabde7aa572255b0c587943f5f658f067ac5a5af421e22d0",
    "core/compiler/conformance/compiler-v1/dependency-trap.request.json": "0aa1c30e91585eb1d30495194b635b4802a691e6ada998f6d0010b81f6169c53",
    "core/compiler/conformance/compiler-v1/heterogeneous-basic.candidates.json": "9e5e4179060e60ecb0090a7004970dd9186392d01cfbc0537c1f09eb1357a918",
    "core/compiler/conformance/compiler-v1/heterogeneous-basic.request.json": "04c6a4f9cc37efad2cdac52acd05bbf7217d6b27f100de9f9edaf6a315205dc7",
    "core/compiler/conformance/compiler-v1/mandatory-overflow.candidates.json": "c7f8c5dd003078f9d561301123f20792a7cc4fb7863a965d24ffab107a4f4853",
    "core/compiler/conformance/compiler-v1/mandatory-overflow.request.json": "f78ca50929b1b269de945fbbb4ca2b715dfa5755d441f763699bed50c045f24b",
    "core/compiler/conformance/compiler-v1/manifest.json": "202b81b75cba260a940727c6574431764f0c44a1b8e067d7f29b9942e4866afe",
    "core/compiler/conformance/compiler-v1/no-legal-representation.candidates.json": "209b5be17d5ecfa9dafe1693aa85be0a5a2cae7cfa5fad67708653f69f51b585",
    "core/compiler/conformance/compiler-v1/no-legal-representation.request.json": "e68eece3a5c2255565359ffb4dda16e5e56c82a3cb75e25e3fbdb002b58d23bc",
    "core/compiler/conformance/compiler-v1/qualification-trap.candidates.json": "7d61996fef908751dc23b5de722a918b5dad050f66fbaac1bc49ccbd7895b8c9",
    "core/compiler/conformance/compiler-v1/qualification-trap.request.json": "7474bcaf1015052142445a56cf22d0370525668992756b0ff6b4f9e3b6e2aee7",
    "core/compiler/conformance/compiler-v1/rendered-overflow.candidates.json": "405b6a6c33180a274453ceeba16db2ed2af9784f9e7611c1d531cce60d7929bf",
    "core/compiler/conformance/compiler-v1/rendered-overflow.request.json": "a91b477a35bbf92d90d1e036cb3b0033d557e9ef97bf051aa07b46f809dd919b",
    "core/compiler/conformance/compiler-v1/representation-alternatives.candidates.json": "a7e3503665ee29616d288eebbe8c879c1ba437e78f55648c10ee96d0b3f7b9f8",
    "core/compiler/conformance/compiler-v1/representation-alternatives.request.json": "fe456c4804d944e41e85c5d50dbd05e108df034fd0f2f5bb0057d080aa301d3a",
    "core/compiler/conformance/compiler-v1/required-unavailable.candidates.json": "fd18fd08a0f035722c062f3c5b10a0d7eb100786374da86dcaea8875e3545356",
    "core/compiler/conformance/compiler-v1/required-unavailable.request.json": "a2bffcdef012c95d9a38e4aaa879c08ed02e80f94c9a11ab267da9a5c29735a2",
    "core/compiler/conformance/compiler-v1/shared-dependency.candidates.json": "bfdf1c61046c24b014288c920a0aaea1e1b5e8e15e30bab45daed0b33215d64d",
    "core/compiler/conformance/compiler-v1/shared-dependency.request.json": "19f576dacbfaf1a8f42f90c9577c0f39548263af774042ce82bed02701287b20",
    "core/compiler/conformance/compiler-v1/stale-cheap.candidates.json": "34b3cb10f5564129ca680be559f9930ca1debfb896e9a2bd96e3fb9b4f7df209",
    "core/compiler/conformance/compiler-v1/stale-cheap.request.json": "91f55ffffa25f0e980771d6d98eb37d22c8f54a9fd30d2ac42d987fb39d2b4ec",
    "core/compiler/conformance/compiler-v1/wrong-scope.candidates.json": "bd54226b9c7e9a838314bdb57d388b764a7ae507b12ec20653634c0efa36784d",
    "core/compiler/conformance/compiler-v1/wrong-scope.request.json": "f2aa3b849b630ce07eda65e1d9c129ff2853b02a36da63927eefaa52ddafaa36",
    "core/compiler/conformance/completeness-v1/README.md": "ee07797f23fddb30efa4add6234c874605aaad6fd7c9e3ae9db4d0e21d149fb7",
    "core/compiler/conformance/completeness-v1/greedy-false-refusal.candidates.json": "2b2b25415f817a1d62f3ad117a96b9bf9079522818c08dbbf4ed9de593711a58",
    "core/compiler/conformance/completeness-v1/greedy-false-refusal.request.json": "5251d7444fb619a80a72a955649e7160b750129d6a011e8ba11f5317d196c7b5",